{
  "format": "org.fpv.race-event.announcement-history",
  "version": 1,
  "eventSessionId": "forest-finale-session-1",
  "items": [
    {
      "announcementId": "ann-h17-rerun-1",
      "eventSessionId": "forest-finale-session-1",
      "title": "H17 Rerun",
      "body": "Heat 17 will be repeated after a race incident.",
      "importance": 3,
      "createdAt": "2026-09-06T12:40:00.000Z",
      "createdByDeviceId": "race-manager-tablet",
      "expiresAt": null,
      "status": "cleared",
      "clearedAt": "2026-09-06T13:05:00.000Z",
      "expiredAt": null
    },
    {
      "announcementId": "ann-h18-channels-1",
      "eventSessionId": "forest-finale-session-1",
      "title": "H18 Channels Changed",
      "body": "PilotOne R1 -> R8, PilotTwo R8 -> R1",
      "importance": 3,
      "createdAt": "2026-09-06T13:20:00.000Z",
      "createdByDeviceId": "race-manager-tablet",
      "expiresAt": null,
      "status": "active",
      "clearedAt": null,
      "expiredAt": null
    }
  ],
  "nextCursor": null
}
